{
  "review_summary": "初稿基本符合新闻稿文种规则和结构规划，事实均来自extract结果，无RAG事实污染，称谓正确，风险提示充分。但manual_confirmation_fields中缺少对成果名称和主办单位的确认项，建议补充。",
  "pass": true,
  "score": 95,
  "rewrite_required": false,
  "risk_level": "low",
  "checks": {
    "doc_type_check": {
      "status": "pass",
      "summary": "文种为新闻稿，正文包含标题、导语、事件主体、意义结尾，符合新闻稿规范，无文种错误。",
      "issues_count": 0
    },
    "structure_check": {
      "status": "pass",
      "summary": "正文结构按plan的sections（标题、导语、事件主体、主要内容、意义价值、结尾）组织，顺序合理，内容基本匹配。",
      "issues_count": 0
    },
    "fact_grounding_check": {
      "status": "pass",
      "summary": "正文中所有事实（时间、地点、事件、成果）均可追溯到extract_result.fact_items，无新增无依据事实。",
      "issues_count": 0
    },
    "fact_usage_report_check": {
      "status": "pass",
      "summary": "fact_usage_report覆盖了正文中的关键事实，来源均为extract_result，无伪造或遗漏。",
      "issues_count": 0
    },
    "rag_usage_check": {
      "status": "pass",
      "summary": "RAG仅用于标题风格和导语句式，copied_verbatim为false，fact_risk为false，无事实污染。",
      "issues_count": 0
    },
    "terminology_check": {
      "status": "pass",
      "summary": "正文称谓仅使用'马栏山'，符合org-title-dictionary，无禁用称谓。",
      "issues_count": 0
    },
    "blocked_items_check": {
      "status": "pass",
      "summary": "blocked_items均未进入正文，正文使用概括性表述，未编造领导出席、评价、具体名称等。",
      "issues_count": 0
    },
    "warnings_check": {
      "status": "pass",
      "summary": "warnings完整承接了extract和plan中的缺失字段风险，对成果名称、主办单位、组织信息、领导出席均给出提示。",
      "issues_count": 0
    },
    "manual_confirmation_check": {
      "status": "warning",
      "summary": "draft的manual_confirmation_fields仅列出'参与组织具体名称'，缺少对'成果具体名称'和'活动主办单位'的确认项，建议补充。",
      "issues_count": 1
    },
    "style_check": {
      "status": "pass",
      "summary": "style_level=3，正文使用芒果系战略表达，无过度宣传，符合新闻宣传风。",
      "issues_count": 0
    },
    "format_check": {
      "status": "pass",
      "summary": "Markdown格式正确，标题、段落清晰，无乱码或格式错误。",
      "issues_count": 0
    }
  },
  "issues": [
    {
      "issue_id": "R001",
      "level": "medium",
      "type": "manual_confirmation_missing",
      "location": "draft_result.manual_confirmation_fields",
      "detail": "draft的manual_confirmation_fields仅包含'参与组织具体名称'，但extract和plan的missing_fields还包括'成果具体名称'和'活动主办单位'，需要人工确认。",
      "evidence": "manual_confirmation_fields: [{'field': '参与组织具体名称'}]",
      "suggestion": "在manual_confirmation_fields中增加'成果具体名称'和'活动主办单位'两项确认字段。",
      "rewrite_hint": "无需改动正文，仅补充确认项列表。"
    }
  ],
  "rewrite_instructions": [],
  "manual_confirmation_fields": [
    {
      "field": "成果具体名称",
      "reason": "用户仅提供'三项创新成果'，未提供具体名称，影响新闻稿主体内容具体性",
      "impact": "正文目前使用概括表述，如有具体名称可替换提升信息量",
      "required_before_final": false
    },
    {
      "field": "活动主办单位",
      "reason": "用户未提供活动主办单位，正文未提及，但若有则可增加活动背景",
      "impact": "影响活动归属和背景说明",
      "required_before_final": false
    },
    {
      "field": "参与组织具体名称",
      "reason": "extract阶段未抽取，用户初稿提及'湖南广电集团'和'芒果超媒'但未纳入fact_items",
      "impact": "影响新闻稿主体内容的具体性",
      "required_before_final": false
    }
  ],
  "review_policy": {
    "no_body_generation": true,
    "no_rewrite": true,
    "no_new_facts": true,
    "no_rag_call": true,
    "check_fact_grounding": true,
    "check_doc_type_rules": true,
    "check_org_title_dictionary": true
  }
}