{
  "review_summary": "draft 按请示文种生成，结构合规，事实均来自 extract，无 RAG 污染，称谓和格式基本规范。但文种冲突（用户指定报告）和预算金额、主送单位等缺失已在 warnings 和 manual_confirmation_fields 中标注，需人工确认。正文整体可通过，无需改写。",
  "pass": true,
  "score": 92,
  "rewrite_required": false,
  "risk_level": "high",
  "checks": {
    "doc_type_check": {
      "status": "pass",
      "summary": "文种为请示，一文一事，结尾使用‘妥否，请批示’，符合请示规范。文种冲突已在 warnings 中说明。",
      "issues_count": 0
    },
    "structure_check": {
      "status": "pass",
      "summary": "正文按请示缘由、必要性与依据、请示事项、请求批示四段式生成，与 plan_result.sections 一致。",
      "issues_count": 0
    },
    "fact_grounding_check": {
      "status": "pass",
      "summary": "正文所有事实均可在 extract_result 中找到对应来源，无新增事实。",
      "issues_count": 0
    },
    "fact_usage_report_check": {
      "status": "pass",
      "summary": "fact_usage_report 覆盖了正文中所有重要事实，source_text 均来自 extract_result.fact_items，无遗漏或伪造。",
      "issues_count": 0
    },
    "rag_usage_check": {
      "status": "pass",
      "summary": "rag_usage_report 为空，正文无 RAG 事实污染。",
      "issues_count": 0
    },
    "terminology_check": {
      "status": "warning",
      "summary": "主送单位使用‘集团’，称谓库接受但需确认正式全称；项目正式名称缺失，使用‘该项目’概括。已在 warnings 中提示。",
      "issues_count": 0
    },
    "blocked_items_check": {
      "status": "pass",
      "summary": "blocked_items（预算金额、项目预期成效、一文多事、特此报告）均未出现在正文中。",
      "issues_count": 0
    },
    "warnings_check": {
      "status": "pass",
      "summary": "warnings 完整承接了文种冲突、预算金额缺失、主送单位缺失、项目正式名称缺失、占位符使用等风险。",
      "issues_count": 0
    },
    "manual_confirmation_check": {
      "status": "pass",
      "summary": "manual_confirmation_fields 保留了最终文种、预算金额、主送单位全称、项目正式名称、落款单位等关键确认项。",
      "issues_count": 0
    },
    "style_check": {
      "status": "pass",
      "summary": "style_level=1 要求克制正式，正文语言庄重，无过度宣传表达。",
      "issues_count": 0
    },
    "format_check": {
      "status": "pass",
      "summary": "Markdown 格式正确，标题、主送单位占位、结尾、占位符使用符合请示格式。",
      "issues_count": 0
    }
  },
  "issues": [],
  "rewrite_instructions": [],
  "manual_confirmation_fields": [
    {
      "field": "最终文种",
      "reason": "用户指定报告，但系统识别为请示",
      "impact": "影响全文结构和结尾表达",
      "required_before_final": true
    },
    {
      "field": "预算金额",
      "reason": "用户请求预算支持但未提供金额",
      "impact": "影响请示事项明确性",
      "required_before_final": false
    },
    {
      "field": "主送单位全称",
      "reason": "用户仅写'集团'",
      "impact": "影响公文抬头",
      "required_before_final": true
    },
    {
      "field": "项目正式名称",
      "reason": "标题和正文需要",
      "impact": "影响准确性",
      "required_before_final": true
    },
    {
      "field": "落款单位",
      "reason": "请示必须有落款",
      "impact": "影响公文完整性",
      "required_before_final": true
    }
  ],
  "review_policy": {
    "no_body_generation": true,
    "no_rewrite": true,
    "no_new_facts": true,
    "no_rag_call": true,
    "check_fact_grounding": true,
    "check_doc_type_rules": true,
    "check_org_title_dictionary": true
  }
}