{
  "review_summary": "draft基本按新闻稿结构生成，文种正确。但正文出现未授权事实：第三段具体参赛领域（AI编剧、AI视觉生成、智能剪辑）在extract中无来源，且属于编造成果技术细节；第一段对'全流程'的具体环节描述也缺乏直接来源。fact_usage_report未覆盖这些新增内容。manual_confirmation_fields缺失意义价值段落的人工确认占位。需要修订。",
  "pass": false,
  "score": 70,
  "rewrite_required": true,
  "risk_level": "medium",
  "checks": {
    "doc_type_check": {
      "status": "pass",
      "summary": "文种为新闻稿，符合classify结果。导语含时间、主体、事件，无编造领导出席/评价，符合新闻稿规则。",
      "issues_count": 0
    },
    "structure_check": {
      "status": "pass",
      "summary": "段落结构基本符合plan（标题、导语+事件主体、主体展开、内容概览、意义价值、结尾），无缺失。",
      "issues_count": 0
    },
    "fact_grounding_check": {
      "status": "fail",
      "summary": "正文'参赛作品涵盖AI编剧、AI视觉生成、智能剪辑等领域'在extract中无对应事实，属于无依据新增；'从剧本生成、拍摄调度到后期制作'对'全流程'的具体化缺乏来源。",
      "issues_count": 2
    },
    "fact_usage_report_check": {
      "status": "fail",
      "summary": "fact_usage_report漏记了正文中的新增事实（具体领域、环节描述），存在覆盖漏洞。",
      "issues_count": 1
    },
    "rag_usage_check": {
      "status": "pass",
      "summary": "RAG仅用于标题风格和结尾句式，未发现事实污染。",
      "issues_count": 0
    },
    "terminology_check": {
      "status": "pass",
      "summary": "机构称谓'芒果超媒股份有限公司'符合口径库，产品名称正确，无禁用称谓。",
      "issues_count": 0
    },
    "blocked_items_check": {
      "status": "fail",
      "summary": "第三段'AI编剧、AI视觉生成、智能剪辑'属于编造成果技术细节，违反blocked_items规则。",
      "issues_count": 1
    },
    "warnings_check": {
      "status": "warning",
      "summary": "draft warnings已提及地点缺失、团队名称缺失、意义价值段无事实，但未覆盖新增事实的风险。",
      "issues_count": 1
    },
    "manual_confirmation_check": {
      "status": "fail",
      "summary": "plan要求'意义价值段落内容'需人工确认，但draft的manual_confirmation_fields为空，缺失该确认项。",
      "issues_count": 1
    },
    "style_check": {
      "status": "pass",
      "summary": "风格level 3，芒果系新闻宣传风，无过度拔高。",
      "issues_count": 0
    },
    "format_check": {
      "status": "pass",
      "summary": "Markdown格式正确，标题、段落清晰，无乱码。",
      "issues_count": 0
    }
  },
  "issues": [
    {
      "issue_id": "R001",
      "level": "high",
      "type": "fact_not_grounded",
      "location": "markdown_draft 第3段",
      "detail": "正文'参赛作品涵盖AI编剧、AI视觉生成、智能剪辑等领域'无任何extract事实支撑，属于编造成果技术细节。",
      "evidence": "参赛作品涵盖AI编剧、AI视觉生成、智能剪辑等领域",
      "suggestion": "删除该句，或改为基于用户素材的概括表述（如'参赛作品围绕AI技术在内容创作中的应用展开'）。",
      "rewrite_hint": "删除'参赛作品涵盖AI编剧、AI视觉生成、智能剪辑等领域'，保留'本次大赛聚焦AI内容创作前沿方向'。"
    },
    {
      "issue_id": "R002",
      "level": "medium",
      "type": "fact_not_grounded",
      "location": "markdown_draft 第2段",
      "detail": "正文'从剧本生成、拍摄调度到后期制作'对'全流程'的具体环节描述在extract中未明确提供，属于合理推断但无直接来源。",
      "evidence": "从剧本生成、拍摄调度到后期制作",
      "suggestion": "建议改为'实现了全流程AI辅助制作'（与extract一致），或保留原句但标注需人工确认。",
      "rewrite_hint": "改为'该作品实现了全流程AI辅助制作'，删除具体环节列举。"
    },
    {
      "issue_id": "R003",
      "level": "medium",
      "type": "fact_usage_missing",
      "location": "fact_usage_report",
      "detail": "fact_usage_report未记录正文第2段'从剧本生成、拍摄调度到后期制作'和第3段具体领域等新增内容，造成溯源盲区。",
      "evidence": "fact_usage_report仅6条，缺失2处新增事实",
      "suggestion": "补充fact_usage_report或修订正文以覆盖所有事实。",
      "rewrite_hint": "将新增事实从正文删除后，fact_usage_report无需补充。"
    },
    {
      "issue_id": "R004",
      "level": "medium",
      "type": "manual_confirmation_missing",
      "location": "markdown_draft 第4段",
      "detail": "plan要求'意义价值段落内容'需人工确认（因无事实支撑），但draft的manual_confirmation_fields为空，未保留该确认项。",
      "evidence": "manual_confirmation_fields = []",
      "suggestion": "在manual_confirmation_fields中添加'意义价值段落内容'确认项，或在正文中添加【需人工确认】标记。",
      "rewrite_hint": "在稿末添加注：'【意义价值段落已由人工确认】'，或保留原样但标记确认字段。"
    },
    {
      "issue_id": "R005",
      "level": "medium",
      "type": "blocked_item_used",
      "location": "markdown_draft 第3段",
      "detail": "正文出现'AI编剧、AI视觉生成、智能剪辑'等具体领域信息，属于blocked_items中的'不得编造成果技术细节'。",
      "evidence": "参赛作品涵盖AI编剧、AI视觉生成、智能剪辑等领域",
      "suggestion": "删除该表述，避免违反规则。",
      "rewrite_hint": "同R001。"
    }
  ],
  "rewrite_instructions": [
    {
      "priority": "high",
      "target": "markdown_draft 第3段",
      "action": "delete",
      "instruction": "删除'参赛作品涵盖AI编剧、AI视觉生成、智能剪辑等领域'，保留'本次大赛聚焦AI内容创作前沿方向'。",
      "basis": "extract_result中无对应事实；blocked_items规则禁止编造成果技术细节"
    },
    {
      "priority": "medium",
      "target": "markdown_draft 第2段",
      "action": "replace",
      "instruction": "将'从剧本生成、拍摄调度到后期制作的全流程AI辅助制作'改为'实现了全流程AI辅助制作'，与extract一致。",
      "basis": "extract_result.fact_items中仅提供'一等奖作品《AI导演》实现了全流程AI辅助制作'，未提供具体环节"
    },
    {
      "priority": "medium",
      "target": "markdown_draft manual_confirmation_fields",
      "action": "add_warning",
      "instruction": "在manual_confirmation_fields中添加{'field':'意义价值段落内容','reason':'该段无事实支撑，需人工确认','impact':'影响新闻稿内容真实性'}",
      "basis": "plan_result.manual_confirmation_fields要求人工确认"
    }
  ],
  "manual_confirmation_fields": [
    {
      "field": "意义价值段落内容",
      "reason": "该段无事实支撑，使用了概括性升华表述，需人工确认是否保留或补充具体意义。",
      "impact": "影响新闻稿内容真实性及芒果系风格表达",
      "required_before_final": false
    }
  ],
  "review_policy": {
    "no_body_generation": true,
    "no_rewrite": true,
    "no_new_facts": true,
    "no_rag_call": true,
    "check_fact_grounding": true,
    "check_doc_type_rules": true,
    "check_org_title_dictionary": true
  },
  "expansion_review": {
    "status": "fail",
    "summary": "draft中存在未在expansion_report中记录的扩写内容：具体领域和环节细节。其中具体领域属于危险虚构，需删除；环节细节需确认。",
    "acceptable_expansion": [],
    "unsafe_fabrication": [
      {
        "text": "参赛作品涵盖AI编剧、AI视觉生成、智能剪辑等领域",
        "reason": "用户素材未提供任何参赛作品具体领域，属于编造成果技术细节，违反blocked_items和fact_grounding。"
      }
    ],
    "confirmation_required": [
      {
        "text": "从剧本生成、拍摄调度到后期制作",
        "reason": "对'全流程'的具体环节描述，用户素材未提供，属于合理推断但需人工确认是否准确。"
      }
    ]
  }
}