{
  "review_summary": "初稿基本符合新闻稿文种和结构要求，但存在多处事实无来源问题：\"芒果大模型\"、\"创意生成、脚本编写到后期制作\"等细节未在extract_result中提供，属于新增事实。fact_usage_report未覆盖这些内容，warnings也缺失相关提示。需要修订。",
  "pass": false,
  "score": 60,
  "rewrite_required": true,
  "risk_level": "high",
  "checks": {
    "doc_type_check": {
      "status": "pass",
      "summary": "文种为新闻稿，导语、主体、结尾完整，未出现编造领导信息等违规内容。",
      "issues_count": 0
    },
    "structure_check": {
      "status": "pass",
      "summary": "标题、导语、事件主体、主要内容、意义价值、结尾六段式结构完整，符合plan_result.sections安排。",
      "issues_count": 0
    },
    "fact_grounding_check": {
      "status": "fail",
      "summary": "正文出现\"芒果大模型\"、\"创意生成、脚本编写到后期制作\"、\"为内容生产提供了全新思路\"等表述，无法在extract_result中找到对应事实来源。",
      "issues_count": 3
    },
    "fact_usage_report_check": {
      "status": "fail",
      "summary": "fact_usage_report仅记录了6个有来源事实，但正文中新增的\"芒果大模型\"等细节未在报告中体现，存在事实溯源遗漏。",
      "issues_count": 1
    },
    "rag_usage_check": {
      "status": "pass",
      "summary": "rag_usage_report仅使用了风格参考，未引入事实污染。正文中的\"融合创新\"\"智媒跃升\"属于风格借鉴，符合style-rag-policy。",
      "issues_count": 0
    },
    "terminology_check": {
      "status": "pass",
      "summary": "称谓\"芒果超媒\"\"AI内容创作大赛\"\"《AI导演》\"\"芒果大模型\"均符合org-title-dictionary.yaml。",
      "issues_count": 0
    },
    "blocked_items_check": {
      "status": "pass",
      "summary": "blocked_items中的禁止内容（编造领导出席、评价、数据、地点、团队名称）均未出现在正文中。",
      "issues_count": 0
    },
    "warnings_check": {
      "status": "fail",
      "summary": "draft_result.warnings提示了地点缺失和团队名称缺失，但未对正文中新增的\"芒果大模型\"等无依据事实发出风险提示。",
      "issues_count": 1
    },
    "manual_confirmation_check": {
      "status": "pass",
      "summary": "draft_result.manual_confirmation_fields为空，当前无必要的人工确认项被删除。",
      "issues_count": 0
    },
    "style_check": {
      "status": "pass",
      "summary": "style_level=3允许芒果系新闻宣传风，正文使用了战略词汇和展望句式，未过度拔高。",
      "issues_count": 0
    },
    "format_check": {
      "status": "pass",
      "summary": "Markdown标题、段落格式正确，无乱码或公文格式硬伤。",
      "issues_count": 0
    }
  },
  "issues": [
    {
      "issue_id": "R001",
      "level": "high",
      "type": "fact_not_grounded",
      "location": "markdown_draft 第4段",
      "detail": "正文出现\"依托芒果大模型等技术能力\"，但extract_result中未提供\"芒果大模型\"这一事实。",
      "evidence": "依托芒果大模型等技术能力",
      "suggestion": "删除无依据产品名称，或修改为已有依据的表述，如\"依托一等奖作品《AI导演》的技术成果\"。",
      "rewrite_hint": "改为：一等奖作品《AI导演》实现了从创意生成到后期制作的全流程AI辅助制作。"
    },
    {
      "issue_id": "R002",
      "level": "medium",
      "type": "fact_not_grounded",
      "location": "markdown_draft 第4段",
      "detail": "正文将\"全流程AI辅助制作\"拆解为\"创意生成、脚本编写到后期制作\"，但extract_result并未提供这些具体环节。",
      "evidence": "从创意生成、脚本编写到后期制作的全流程AI辅助",
      "suggestion": "保留原extract中的表述\"实现了全流程AI辅助制作\"，不再细化。",
      "rewrite_hint": "改为：一等奖作品《AI导演》实现了全流程AI辅助制作。"
    },
    {
      "issue_id": "R003",
      "level": "medium",
      "type": "fact_not_grounded",
      "location": "markdown_draft 第4段",
      "detail": "正文出现\"为内容生产提供了全新思路\"\"充分体现了AI技术在提升创作效率、拓展内容边界方面的潜力\"等评价性表述，但extract_result未提供这些评价依据。",
      "evidence": "为内容生产提供了全新思路；充分体现了AI技术在提升创作效率、拓展内容边界方面的潜力",
      "suggestion": "删除或弱化评价性表述，仅陈述已提供的事实。",
      "rewrite_hint": "改为：该作品展示了AI辅助内容生产的可行路径。"
    },
    {
      "issue_id": "R004",
      "level": "medium",
      "type": "fact_usage_missing",
      "location": "fact_usage_report",
      "detail": "正文中新增的\"芒果大模型\"等事实未出现在fact_usage_report中，报告不完整。",
      "evidence": "fact_usage_report缺少\"芒果大模型\"\"创意生成、脚本编写\"等",
      "suggestion": "更新fact_usage_report以覆盖所有正文事实，或删除无来源事实。",
      "rewrite_hint": "删除无来源事实后，fact_usage_report无需补充。"
    },
    {
      "issue_id": "R005",
      "level": "low",
      "type": "warning_missing",
      "location": "draft_result.warnings",
      "detail": "warnings中未对正文新增无来源事实（如\"芒果大模型\"）进行风险提示。",
      "evidence": "warnings只提示地点和团队名称缺失",
      "suggestion": "在warnings中添加对无依据事实的提醒。",
      "rewrite_hint": "在warnings中新增：'正文“芒果大模型”无extract来源，需删除或确认。'"
    }
  ],
  "rewrite_instructions": [
    {
      "priority": "high",
      "target": "markdown_draft 第4段",
      "action": "delete_or_replace",
      "instruction": "删除“依托芒果大模型等技术能力”，整句改为“一等奖作品《AI导演》实现了全流程AI辅助制作”。",
      "basis": "extract_result.fact_items[0].achievement: 一等奖作品《AI导演》实现了全流程AI辅助制作"
    },
    {
      "priority": "medium",
      "target": "markdown_draft 第4段",
      "action": "replace",
      "instruction": "将“从创意生成、脚本编写到后期制作的全流程AI辅助”简化为“全流程AI辅助制作”。",
      "basis": "extract_result.fact_items[0].achievement"
    },
    {
      "priority": "medium",
      "target": "markdown_draft 第4段",
      "action": "delete_or_replace",
      "instruction": "删除“为内容生产提供了全新思路”和“充分体现了AI技术在提升创作效率、拓展内容边界方面的潜力”，替换为中性表述如“展示了AI在内容生产中的应用前景”。",
      "basis": "无事实依据，仅保留基于extract的可信内容"
    }
  ],
  "manual_confirmation_fields": [],
  "review_policy": {
    "no_body_generation": true,
    "no_rewrite": true,
    "no_new_facts": true,
    "no_rag_call": true,
    "check_fact_grounding": true,
    "check_doc_type_rules": true,
    "check_org_title_dictionary": true
  },
  "expansion_review": {
    "status": "warning",
    "summary": "generation_mode为safe_official，但正文中存在未在expansion_report中记录的扩展内容（芒果大模型、具体环节拆解、评价性表述），属于expansion_not_labeled。",
    "acceptable_expansion": [
      {
        "text": "“聚焦AI内容创作领域”等过渡句",
        "type": "structure_expansion"
      },
      {
        "text": "“以融合创新激活发展动能”等战略表达",
        "type": "style_expansion"
      }
    ],
    "unsafe_fabrication": [],
    "confirmation_required": [
      {
        "text": "“芒果大模型”",
        "reason": "产品名称非用户提供，存在事实风险"
      },
      {
        "text": "“创意生成、脚本编写到后期制作”",
        "reason": "对“全流程”的细化缺乏依据"
      }
    ]
  }
}