{
  "review_summary": "初稿符合新闻稿文种要求，所有事实均源自extract_result，无新增事实，无RAG污染，称谓正确，风格适当，未发现违规项。",
  "pass": true,
  "score": 100,
  "rewrite_required": false,
  "risk_level": "low",
  "checks": {
    "doc_type_check": {
      "status": "pass",
      "summary": "draft_result.doc_type与classify_result.doc_type一致，均为新闻稿。正文结构、表达符合新闻稿规则，无编造领导出席、评价等违规内容。",
      "issues_count": 0
    },
    "structure_check": {
      "status": "pass",
      "summary": "正文按标题、导语、事件主体、主要内容、意义价值/结尾顺序生成，覆盖plan_result所有section，未缺失关键部分，未新增不必要结构。",
      "issues_count": 0
    },
    "fact_grounding_check": {
      "status": "pass",
      "summary": "正文中所有事实（时间、地点、事件、参与单位、成果发布）均可在extract_result.fact_items中找到对应的source_text，无新增事实。",
      "issues_count": 0
    },
    "fact_usage_report_check": {
      "status": "pass",
      "summary": "draft_result.fact_usage_report完整列出了正文中使用的6个事实，source_text均来自extract_result.fact_items，无遗漏或伪造。",
      "issues_count": 0
    },
    "rag_usage_check": {
      "status": "pass",
      "summary": "rag_usage_report显示仅借鉴标题风格和导语句式，copied_verbatim为false，fact_risk为false。正文未照搬RAG原文或使用RAG旧稿事实。",
      "issues_count": 0
    },
    "terminology_check": {
      "status": "pass",
      "summary": "机构称谓“湖南广电集团”“芒果超媒”与org-title-dictionary.yaml一致，未使用forbidden_names或口语化称谓。",
      "issues_count": 0
    },
    "blocked_items_check": {
      "status": "pass",
      "summary": "plan_result中所有blocked_items（领导出席、领导评价、成果名称等）均未进入正文，draft_result.blocked_items_check如实记录为not_used。",
      "issues_count": 0
    },
    "warnings_check": {
      "status": "pass",
      "summary": "draft_result.warnings完整承接了extract_result.missing_fields（成果名称、领导出席）和rag_usage风险，无遗漏。",
      "issues_count": 0
    },
    "manual_confirmation_check": {
      "status": "pass",
      "summary": "本稿件无需要人工确认的字段，manual_confirmation_fields为空，符合预期。",
      "issues_count": 0
    },
    "style_check": {
      "status": "pass",
      "summary": "style_level=3（芒果系新闻宣传风），正文使用了“融合创新”“数智化转型”等战略表达，风格适度，未过度拔高或编造成果。",
      "issues_count": 0
    },
    "format_check": {
      "status": "pass",
      "summary": "Markdown标题格式正确，正文段落清晰，无乱码或JSON外内容，符合新闻稿格式要求。",
      "issues_count": 0
    }
  },
  "issues": [],
  "rewrite_instructions": [],
  "manual_confirmation_fields": [],
  "review_policy": {
    "no_body_generation": true,
    "no_rewrite": true,
    "no_new_facts": true,
    "no_rag_call": true,
    "check_fact_grounding": true,
    "check_doc_type_rules": true,
    "check_org_title_dictionary": true
  }
}